{
  "task_id":            "70f8926b-c4be-4604-9c33-4e9628bc31f6",
  "provisioner_id":     "jonasfj-test-aws-provisioner",
  "worker_type":        "map-this-to-my-cool-ami",
  "runs":               [],
  "state":              "pending",
  "reason":             "none",
  "routing":            "jonasfjs-precious-tasks.stupid-test.aws",
  "retries":            0,
  "priority":           2.6,
  "created":            "2014-02-01T03:22:36.356Z",
  "deadline":           "2014-03-01T03:22:36.356Z",
  "taken_until":        "1970-01-01T00:00:00.000Z"
}